1058,"5226","Other technical and co-ordinating occupations in motion pictures, broadcasting and the performing arts","Autre personnel technique et personnel de coordination du cinéma, de la radiotélédiffusion et des arts de la scène","Other technical & co-ordinating occupations in motion pictures, broadcasting & the performing arts",,4,1052,2011,343,,A
1059,"5227","Support occupations in motion pictures, broadcasting, photography and the performing arts","Personnel de soutien du cinéma, de la radiotélédiffusion, de la photographie et des arts de la scène","Support occupations in motion pictures, broadcasting, photography & the performing arts",,4,1052,2011,344,,A
1060,"523","Announcers and other performers, n.e.c.								",,"Announcers & other performers, n.e.c.        ",,3,1048,2011,345,,
1061,"5231",Announcers and other broadcasters,Annonceurs/annonceuses et autres communicateurs/communicatrices,Announcers & other broadcasters,,4,1060,2011,346,,A
1062,"5232","Other performers, n.e.c.","Autres artistes de spectacle, n.c.a.","Other performers, n.e.c.",,4,1060,2011,347,,A
1063,"524",Creative designers and craftspersons								,,Creative designers & craftspersons        ,,3,1048,2011,348,,
1064,"5241",Graphic designers and illustrators,Designers graphiques et illustrateurs/illustratrices,Graphic designers & illustrators,,4,1063,2011,349,,A
1065,"5242",Interior designers and interior decorators,Designers d'intérieur et décorateurs/décoratrices d'intérieur,Interior designers & interior decorators,,4,1063,2011,350,,A
1066,"5243","Theatre, fashion, exhibit and other creative designers","Ensembliers/ensemblières de théâtre, dessinateurs/dessinatrices de mode, concepteurs/conceptrices d'expositions et autres concepteurs/conceptrices artistiques","Theatre, fashion, exhibit & other creative designers",,4,1063,2011,351,,A
1067,"5244",Artisans and craftspersons,Artisans/artisanes,Artisans & craftspersons,,4,1063,2011,352,,A
1068,"5245","Patternmakers - textile, leather and fur products",Patronniers/patronnières de produits textiles et d'articles en cuir et en fourrure,"Patternmakers - textile, leather & fur products",,4,1063,2011,353,,A
1069,"525","Athletes, coaches, referees and related occupations						",,"Athletes, coaches, referees & related occupations      ",,3,1048,2011,354,,
1070,"5251",Athletes,Athlètes,Athletes,,4,1069,2011,355,,B
1071,"5252",Coaches,Entraîneurs/entraîneuses,Coaches,,4,1069,2011,356,,O
1072,"5253",Sports officials and referees,Arbitres et officiels/officielles de sports,Sports officials & referees,,4,1069,2011,357,,O
1073,"5254","Program leaders and instructors in recreation, sport and fitness","Animateurs/animatrices et responsables de programmes de sports, de loisirs et de conditionnement physique","Program leaders & instructors in recreation, sport & fitness",,4,1069,2011,358,,A
1074,"6",Sales and service occupations,,Sales & service occupations,,1,,2011,359,,
1075,"43",Occupations in front-line public protection services,,Occupations in front-line public protection services,,2,989,2011,360,,
1076,"62",Retail sales supervisors and specialized sales occupations,,Retail sales supervisors & specialized sales occupations,,2,1074,2011,360,,
1077,"63",Service supervisors and specialized service occupations,,Service supervisors & specialized service occupations,,2,1074,2011,360,,
1078,"621",Retail sales supervisors										,,Retail sales supervisors          ,,3,1076,2011,361,,
1079,"6211",Retail sales supervisors,Superviseurs/superviseures des ventes - commerce de détail,Retail sales supervisors,,4,1078,2011,362,,B
1080,"6311",Food service supervisors,Superviseurs/superviseures des services alimentaires,Food service supervisors,,4,1117,2011,363,,B
1081,"6312",Executive housekeepers,Gouvernants principaux/gouvernantes principales,Executive housekeepers,,4,1117,2011,364,,B
1082,"6316",Other services supervisors,Surveillants/surveillantes des autres services,Other services supervisors,,4,1117,2011,365,,A
1083,"6315",Cleaning supervisors,Surveillants/surveillantes des services de nettoyage,Cleaning supervisors,,4,1117,2011,366,,B
1084,"6313","Accommodation, travel, tourism and related services supervisors","Superviseurs/superviseures des services d'hébergement, de voyages, de tourisme et des services connexes","Accommodation, travel, tourism & related services supervisors",,4,1117,2011,367,,B
1085,"622",Technical sales specialists in wholesale trade and retail and wholesale buyers			,,Technical sales specialists in wholesale trade & retail & wholesale buyers   ,,3,1076,2011,368,,
1086,"6221",Technical sales specialists - wholesale trade,Spécialistes des ventes techniques - commerce de gros,Technical sales specialists - wholesale trade,,4,1085,2011,369,,O
1087,"623","Insurance, real estate and financial sales occupations						",,"Insurance, real estate & financial sales occupations      ",,3,1076,2011,370,,
1088,"6231",Insurance agents and brokers,Agents/agentes et courtiers/courtières d'assurance,Insurance agents & brokers,,4,1087,2011,371,,A
1089,"6232",Real estate agents and salespersons,Agents/agentes et vendeurs/vendeuses en immobilier,Real estate agents & salespersons,,4,1087,2011,372,,A
1090,"6222",Retail and wholesale buyers,Acheteurs/acheteuses des commerces de détail et de gros,Retail & wholesale buyers,,4,1085,2011,373,,A
1091,"632",Chefs and cooks											,,Chefs & cooks           ,,3,1077,2011,375,1,
1092,"6321",Chefs,Chefs,Chefs,,4,1091,2011,376,,A
1093,"6322",Cooks,Cuisiniers/cuisinières,Cooks,,4,1091,2011,377,,D
1094,"633",Butchers and bakers										,,Butchers & bakers          ,,3,1077,2011,378,1,
1095,"6331","Butchers, meat cutters and fishmongers - retail and wholesale","Bouchers/bouchères, coupeurs/coupeuses de viande et poissonniers/poissonnières - commerce de gros et de détail","Butchers, meat cutters & fishmongers - retail & wholesale",,4,1094,2011,379,,D
1096,"6332",Bakers,Boulangers-pâtissiers/boulangères-pâtissières,Bakers,,4,1094,2011,380,,D
1097,"431",Occupations in front-line public protection services						 ,,Occupations in front-line public protection services       ,,3,1075,2011,381,,
1098,"4311",Police officers (except commissioned),Policiers/policières (sauf cadres supérieurs),Police officers (except commissioned),,4,1097,2011,382,,A
1099,"4312",Firefighters,Pompiers/pompières,Firefighters,,4,1097,2011,383,,A
1100,"634",Specialized occupations in personal and customer services						,,Specialized occupations in personal & customer services      ,,3,1077,2011,384,1,
1101,"6341",Hairstylists and barbers,Coiffeurs/coiffeuses et barbiers,Hairstylists & barbers,,4,1100,2011,385,,D
1102,"6346",Funeral directors and embalmers,Directeurs/directrices de funérailles et embaumeurs/embaumeuses,Funeral directors & embalmers,,4,1100,2011,386,,D
1103,"44","Care providers and educational, legal and public protection support occupations",,"Care providers & educational, legal & public protection support occupations",,2,989,2011,387,,
1104,"64",Sales representatives and salespersons - wholesale and retail trade,,Sales representatives & salespersons - wholesale & retail trade,,2,1074,2011,387,,
1105,"65",Service representatives and other customer and personal services occupations,,Service representatives & other customer & personal services occupations,,2,1074,2011,387,,
1106,"641",Sales and account representatives - wholesale trade (non-technical)				,,Sales & account representatives - wholesale trade (non-technical)    ,,3,1104,2011,388,,
1107,"6411",Sales and account representatives - wholesale trade (non-technical),Représentants/représentantes des ventes et des comptes - commerce de gros (non-technique),Sales & account representatives - wholesale trade (non-technical),,4,1106,2011,389,,A
1108,"642",Retail salespersons										,,Retail salespersons          ,,3,1104,2011,390,,
1109,"6421",Retail salespersons,Vendeurs/vendeuses - commerce de détail,Retail salespersons,,4,1108,2011,391,,B
1110,"652",Occupations in travel and accommodation								,,Occupations in travel & accommodation        ,,3,1105,2011,392,,
1111,"6521",Travel counsellors,Conseillers/conseillères en voyages,Travel counsellors,,4,1110,2011,393,,A
1112,"6522",Pursers and flight attendants,Commissaires et agents/agentes de bord,Pursers & flight attendants,,4,1110,2011,394,,A
1113,"6523",Airline ticket and service agents,Agents/agentes à la billetterie et aux services aériens,Airline ticket & service agents,,4,1110,2011,395,,A
1114,"6524","Ground and water transport ticket agents, cargo service representatives and related clerks","Agents/agentes à la billetterie, représentants/représentantes du service en matière de fret et personnel assimilé dans le transport routier et maritime","Ground & water transport ticket agents, cargo service representatives & related clerks",,4,1110,2011,396,,B
1115,"6525",Hotel front desk clerks,Réceptionnistes d'hôtel,Hotel front desk clerks,,4,1110,2011,397,,A
1116,"653",Tourism and amusement services occupations							,,Tourism & amusement services occupations       ,,3,1105,2011,398,,
1117,"631",Service supervisors										,,Service supervisors          ,,3,1077,2011,398,,
1118,"6531",Tour and travel guides,Guides touristiques et guides itinérants/guides itinérantes,Tour & travel guides,,4,1116,2011,399,,O
1119,"6532",Outdoor sport and recreational guides,Guides d'activités récréatives et sportives de plein air,Outdoor sport & recreational guides,,4,1116,2011,400,,A
1120,"6533",Casino occupations,Personnel préposé au jeu dans les casinos,Casino occupations,,4,1116,2011,401,,B
1121,"651",Occupations in food and beverage service								,,Occupations in food & beverage service        ,,3,1105,2011,402,,
1122,"6511",Maîtres d'hôtel and hosts/hostesses,Maîtres d'hôtel et hôtes/hôtesses,Maîtres d'hôtel & hosts/hostesses,,4,1121,2011,403,,B
1123,"6512",Bartenders,Barmans/barmaids,Bartenders,,4,1121,2011,404,,B
1124,"6513",Food and beverage servers,Serveurs/serveuses d'aliments et de boissons,Food & beverage servers,,4,1121,2011,405,,B
1125,"442",Legal and public protection support occupations							 ,,Legal & public protection support occupations        ,,3,1103,2011,406,,
1126,"4421",Sheriffs and bailiffs,Shérifs et huissiers/huissières de justice,Sheriffs & bailiffs,,4,1125,2011,407,,A
1127,"4422",Correctional service officers,Agents/agentes de services correctionnels,Correctional service officers,,4,1125,2011,408,,A
1128,"4423","By-law enforcement and other regulatory officers, n.e.c.","Agents/agentes d'application de règlements municipaux et autres agents/agentes de réglementation, n.c.a.","By-law enforcement & other regulatory officers, n.e.c.",,4,1125,2011,409,,A
1129,"4313",Non-commissioned ranks of the Canadian Armed Forces,Sous-officiers/sous-officières des Forces armées canadiennes,Non-commissioned ranks of the canadian forces,,4,1097,2011,410,,B
1130,"441",Home care providers and educational support occupations						 ,,Home care providers & educational support occupations       ,,3,1103,2011,412,,
1131,"4412","Home support workers, housekeepers and related occupations","Aides familiaux résidents/aides familiales résidentes, aides de maintien à domicile et personnel assimilé","Home support workers, housekeepers & related occupations",,4,1130,2011,413,,A
1132,"4413",Elementary and secondary school teacher assistants,Aides-enseignants/aides-enseignantes aux niveaux primaire et secondaire,Elementary & secondary school teacher assistants,,4,1130,2011,414,,A
1133,"4411",Home child care providers,Gardiens/gardiennes d'enfants en milieu familial,Home child care providers,,4,1130,2011,415,,A
1134,"656",Other occupations in personal service								,,Other occupations in personal service        ,,3,1105,2011,416,,
1135,"6561","Image, social and other personal consultants","Conseillers/conseillères imagistes, conseillers mondains/conseillères mondaines et autres conseillers/conseillères en soins personnalisés","Image, social & other personal consultants",,4,1134,2011,417,,A
1136,"6562","Estheticians, electrologists and related occupations","Esthéticiens/esthéticiennes, électrolystes et personnel assimilé","Estheticians, electrologists & related occupations",,4,1134,2011,418,,D
1137,"6563",Pet groomers and animal care workers,Soigneurs/soigneuses d'animaux et travailleurs/travailleuses en soins des animaux,Pet groomers & animal care workers,,4,1134,2011,419,,A
1138,"6564",Other personal service occupations,Autre personnel de services personnalisés,Other personal service occupations,,4,1134,2011,420,,B
1139,"66",Sales support occupations,,Sales support occupations,,2,1074,2011,421,,
1140,"661",Cashiers												,,Cashiers            ,,3,1139,2011,422,,
1141,"6611",Cashiers,Caissiers/caissières,Cashiers,,4,1140,2011,423,,B
1142,"662",Other sales support and related occupations							,,Other sales support & related occupations       ,,3,1139,2011,424,,
1143,"6621",Service station attendants,Préposés/préposées de stations-service,Service station attendants,,4,1142,2011,425,,B
1144,"6622","Store shelf stockers, clerks and order fillers","Garnisseurs/garnisseuses de tablettes, commis et préposés/préposées aux commandes dans les magasins","Store shelf stockers, clerks & order fillers",,4,1142,2011,426,,B
1145,"6623",Other sales related occupations,Autre personnel assimilé des ventes,Other sales related occupations,,4,1142,2011,427,,A
1146,"671","Food counter attendants, kitchen helpers and related support occupations				",,"Food counter attendants, kitchen helpers & related support occupations    ",,3,1242,2011,428,,
1147,"6711","Food counter attendants, kitchen helpers and related support occupations","Serveurs/serveuses au comptoir, aides de cuisine et personnel de soutien assimilé","Food counter attendants, kitchen helpers & related support occupations",,4,1146,2011,429,,B
1148,"654",Security guards and related security service occupations						,,Security guards & related security service occupations      ,,3,1105,2011,430,,
1149,"6541",Security guards and related security service occupations,Agents/agentes de sécurité et personnel assimilé des services de sécurité,Security guards & related security service occupations,,4,1148,2011,431,,A
1150,"673",Cleaners												,,Cleaners            ,,3,1242,2011,432,,
1151,"6731",Light duty cleaners,Préposés/préposées à l'entretien ménager et au nettoyage - travaux légers,Light duty cleaners,,4,1150,2011,433,,B
1152,"6732",Specialized cleaners,Nettoyeurs spécialisés/nettoyeuses spécialisées,Specialized cleaners,,4,1150,2011,434,,B
1153,"6733","Janitors, caretakers and building superintendents",Concierges et surintendants/surintendantes d'immeubles,"Janitors, caretakers & building superintendents",,4,1150,2011,435,,B
1154,"672","Support occupations in accommodation, travel and amusement services				",,"Support occupations in accommodation, travel & amusement services    ",,3,1242,2011,436,,
1155,"6722","Operators and attendants in amusement, recreation and sport","Opérateurs/opératrices et préposés/préposées aux sports, aux loisirs et dans les parcs d'attractions","Operators & attendants in amusement, recreation & sport",,4,1154,2011,437,,A
1156,"6721","Support occupations in accommodation, travel and facilities set-up services","Personnel de soutien en services d'hébergement, de voyage et en services de montage d'installation","Support occupations in accommodation, travel & facilities set-up services",,4,1154,2011,438,,A
1157,"674","Other service support and related occupations, n.e.c.						",,"Other service support & related occupations, n.e.c.      ",,3,1242,2011,439,,
1158,"6741","Dry cleaning, laundry and related occupations",Personnel de blanchisseries et d'établissements de nettoyage à sec et personnel assimilé,"Dry cleaning, laundry & related occupations",,4,1157,2011,440,,B
1159,"6742","Other service support occupations, n.e.c.","Autre personnel de soutien en service, n.c.a.","Other service support occupations, n.e.c.",,4,1157,2011,442,,A
1160,"7","Trades, transport and equipment operators and related occupations",,"Trades, transport & equip operators & related occup.",,1,,2011,443,,
1161,"72","Industrial, electrical and construction trades",,"Industrial, electrical & construction trades",,2,1160,2011,444,,
1162,"720","Contractors and supervisors, industrial, electrical and construction trades and related workers	",,"Contractors & supervisors, industrial, electrical & construction trades & related workers ",,3,1161,2011,445,,
1163,"7202","Contractors and supervisors, electrical trades and telecommunications occupations",Entrepreneurs/entrepreneuses et contremaîtres/contremaîtresses en électricité et en télécommunications,"Contractors & supervisors, electrical trades & telecommunications occupations",,4,1162,2011,447,,D
1164,"7203","Contractors and supervisors, pipefitting trades",Entrepreneurs/entrepreneuses et contremaîtres/contremaîtresses en tuyauterie,"Contractors & supervisors, pipefitting trades",,4,1162,2011,448,,D
1165,"7201","Contractors and supervisors, machining, metal forming, shaping and erecting trades and related occupations","Entrepreneurs/entrepreneuses et contremaîtres/contremaîtresses des machinistes et du personnel des métiers du formage, du profilage et du montage des métaux et personnel assimilé","Contractors & supervisors, machining, metal forming, shaping & erecting trades & related occup.",,4,1162,2011,449,,D
1166,"7204","Contractors and supervisors, carpentry trades",Entrepreneurs/entrepreneuses et contremaîtres/contremaîtresses en charpenterie,"Contractors & supervisors, carpentry trades",,4,1162,2011,450,,D
1167,"7301","Contractors and supervisors, mechanic trades",Entrepreneurs/entrepreneuses et contremaîtres/contremaîtresses en mécanique,"Contractors & supervisors, mechanic trades",,4,1171,2011,451,,D
1168,"7302","Contractors and supervisors, heavy equipment operator crews",Entrepreneurs/entrepreneuses et contremaîtres/contremaîtresses des équipes d'opérateurs d'équipement lourd,"Contractors & supervisors, heavy equipment operator crews",,4,1171,2011,452,,D
1169,"7303","Supervisors, printing and related occupations",Surveillants/surveillantes de l'imprimerie et du personnel assimilé,"Supervisors, printing & related occupations",,4,1171,2011,453,,A
1170,"7205","Contractors and supervisors, other construction trades, installers, repairers and servicers",Entrepreneurs/entrepreneuses et contremaîtres/contremaîtresses des autres métiers de la construction et des services de réparation et d'installation,"Contractors & supervisors, other construction trades, installers, repairers & servicers",,4,1162,2011,454,,D
1171,"730","Contractors and supervisors, maintenance trades and heavy equipment and transport operators	",,"Contractors & supervisors, maintenance trades & heavy equipment & transport operators ",,3,1208,2011,455,,
1172,"7304","Supervisors, railway transport operations",Surveillants/surveillantes des opérations du transport ferroviaire,"Supervisors, railway transport operations",,4,1171,2011,456,,B
1173,"7305","Supervisors, motor transport and other ground transit operators",Surveillants/surveillantes du transport routier et du transport en commun,"Supervisors, motor transport & other ground transit operators",,4,1171,2011,457,,A
1174,"723","Machining, metal forming, shaping and erecting trades						",,"Machining, metal forming, shaping & erecting trades      ",,3,1161,2011,458,1,
1175,"7231",Machinists and machining and tooling inspectors,Machinistes et vérificateurs/vérificatrices d'usinage et d'outillage,Machinists & machining & tooling inspectors,,4,1174,2011,459,,D
1176,"7232",Tool and die makers,Outilleurs-ajusteurs/outilleuses-ajusteuses,Tool & die makers,,4,1174,2011,460,,D
1177,"724",Electrical trades and electrical power line and telecommunications workers			,,Electrical trades & electrical power line & telecommunications workers   ,,3,1161,2011,461,1,
1178,"7241",Electricians (except industrial and power system),Électriciens/électriciennes (sauf électriciens industriels/électriciennes industrielles et de réseaux électriques),Electricians (except industrial & power system),,4,1177,2011,462,,D
1179,"7242",Industrial electricians,Électriciens industriels/électriciennes industrielles,Industrial electricians,,4,1177,2011,463,,D
1180,"7243",Power system electricians,Électriciens/électriciennes de réseaux électriques,Power system electricians,,4,1177,2011,464,,D
1181,"7244",Electrical power line and cable workers,Monteurs/monteuses de lignes électriques et de câbles,Electrical power line & cable workers,,4,1177,2011,465,,D
1182,"7245",Telecommunications line and cable workers,Monteurs/monteuses de lignes et de câbles de télécommunications,Telecommunications line & cable workers,,4,1177,2011,466,,A
1183,"7246",Telecommunications installation and repair workers,Installateurs/installatrices et réparateurs/réparatrices de matériel de télécommunications,Telecommunications installation & repair workers,,4,1177,2011,467,,A
1184,"7247",Cable television service and maintenance technicians,Techniciens/techniciennes en montage et en entretien d'installations de câblodistribution,Cable television service & maintenance technicians,,4,1177,2011,468,,A
1185,"725","Plumbers, pipefitters and gas fitters								",,"Plumbers, pipefitters & gas fitters        ",,3,1161,2011,469,1,
1186,"7251",Plumbers,Plombiers/plombières,Plumbers,,4,1185,2011,470,,D
1187,"7252","Steamfitters, pipefitters and sprinkler system installers","Tuyauteurs/tuyauteuses, monteurs/monteuses d'appareils de chauffage et poseurs/poseuses de gicleurs","Steamfitters, pipefitters & sprinkler system installers",,4,1185,2011,471,,D
1188,"7253",Gas fitters,Monteurs/monteuses d'installations au gaz,Gas fitters,,4,1185,2011,472,,D
1189,"7233",Sheet metal workers,Tôliers/tôlières,Sheet metal workers,,4,1174,2011,474,,D
1190,"7234",Boilermakers,Chaudronniers/chaudronnières,Boilermakers,,4,1174,2011,475,,D
1191,"7235",Structural metal and platework fabricators and fitters,Assembleurs/assembleuses et ajusteurs/ajusteuses de plaques et de charpentes métalliques,Structural metal & platework fabricators & fitters,,4,1174,2011,476,,D
1192,"7236",Ironworkers,Monteurs/monteuses de charpentes métalliques,Ironworkers,,4,1174,2011,477,,D
1193,"7237",Welders and related machine operators,Soudeurs/soudeuses et opérateurs/opératrices de machines à souder et à braser,Welders & related machine operators,,4,1174,2011,478,,D
1194,"727",Carpenters and cabinetmakers									,,Carpenters & cabinetmakers         ,,3,1161,2011,480,1,
1195,"7271",Carpenters,Charpentiers-menuisiers/charpentières-menuisières,Carpenters,,4,1194,2011,481,,D
1196,"7272",Cabinetmakers,Ébénistes,Cabinetmakers,,4,1194,2011,482,,D
1197,"728",Masonry and plastering trades									,,Masonry & plastering trades         ,,3,1161,2011,483,1,
1198,"7281",Bricklayers,Briqueteurs-maçons/briqueteuses-maçonnes,Bricklayers,,4,1197,2011,484,,D
1199,"7282",Concrete finishers,Finisseurs/finisseuses de béton,Concrete finishers,,4,1197,2011,485,,B
1200,"7283",Tilesetters,Carreleurs/carreleuses,Tilesetters,,4,1197,2011,486,,D
1201,"7284","Plasterers, drywall installers and finishers and lathers","Plâtriers/plâtrières, poseurs/poseuses et finisseurs/finisseuses de systèmes intérieurs et latteurs/latteuses","Plasterers, drywall installers & finishers & lathers",,4,1197,2011,487,,D
1202,"729",Other construction trades										,,Other construction trades          ,,3,1161,2011,488,1,
1203,"7291",Roofers and shinglers,Couvreurs/couvreuses et poseurs/poseuses de bardeaux,Roofers & shinglers,,4,1202,2011,489,,B
1204,"7292",Glaziers,Vitriers/vitrières,Glaziers,,4,1202,2011,490,,D
1205,"7293",Insulators,Calorifugeurs/calorifugeuses,Insulators,,4,1202,2011,491,,D
1206,"7294",Painters and decorators (except interior decorators),Peintres et décorateurs/décoratrices (sauf décorateurs/décoratrices d'intérieur),Painters & decorators (except interior decorators),,4,1202,2011,492,,B
1207,"7295",Floor covering installers,Poseurs/poseuses de revêtements d'intérieur,Floor covering installers,,4,1202,2011,493,,B
1208,"73",Maintenance and equipment operation trades,,Maintenance & equipment operation trades,,2,1160,2011,494,,
1209,"731",Machinery and transportation equipment mechanics (except motor vehicle)				,,Machinery & transportation equipment mechanics (except motor vehicle)    ,,3,1208,2011,495,1,
1210,"7311",Construction millwrights and industrial mechanics,Mécaniciens/mécaniciennes de chantier et mécaniciens industriels/mécaniciennes industrielles,Construction millwrights & industrial mechanics,,4,1209,2011,496,,D
1211,"7312",Heavy-duty equipment mechanics,Mécaniciens/mécaniciennes d'équipement lourd,Heavy-duty equipment mechanics,,4,1209,2011,497,,D
1212,"7313","Heating, refrigeration and air conditioning mechanics","Mécaniciens/mécaniciennes en chauffage, réfrigération et climatisation",Refrigeration & air conditioning mechanics,,4,1209,2011,498,,D
1213,"7314",Railway carmen/women,Réparateurs/réparatrices de wagons,Railway carmen/women,,4,1209,2011,499,,D
1214,"7315",Aircraft mechanics and aircraft inspectors,Mécaniciens/mécaniciennes et contrôleurs/contrôleuses d'aéronefs,Aircraft mechanics & aircraft inspectors,,4,1209,2011,500,,D
1215,"7316",Machine fitters,Ajusteurs/ajusteuses de machines,Machine fitters,,4,1209,2011,501,,A
1216,"7318",Elevator constructors and mechanics,Constructeurs/constructrices et mécaniciens/mécaniciennes d'ascenseurs,Elevator constructors & mechanics,,4,1209,2011,503,,D
1217,"732",Automotive service technicians									,,Automotive service technicians         ,,3,1208,2011,504,1,
