740,"0422",School principals and administrators of elementary and secondary education,Directeurs/directrices d'école et administrateurs/administratrices de programmes d'enseignement aux niveaux primaire et secondaire,School principals & administrators of elementary & secondary education,,4,737,2011,32,,O
741,"0423","Managers in social, community and correctional services","Directeurs/directrices des services sociaux, communautaires et correctionnels","Managers in social, community & correctional services",,4,737,2011,33,,O
742,"04",Specialized Middle Management Occupations,,Specialized middle management occupations,,2,708,2011,34,,
743,"041",Managers in public administration									 ,,Managers in public administration          ,,3,742,2011,35,,
744,"0411",Government managers - health and social policy development and program administration,Gestionnaires de la fonction publique - élaboration de politiques et administration de programmes sociaux et de santé,Government managers - health & social policy development & program administration,,4,743,2011,36,,O
745,"0412","Government managers - economic analysis, policy development and program administration","Gestionnaires de la fonction publique - analyse économique, élaboration de politiques et administration de programmes","Government managers - economic analysis, policy development & program administration",,4,743,2011,37,,O
746,"0413",Government managers - education policy development and program administration,Gestionnaires de la fonction publique - élaboration de politiques en matière d'éducation et administration de programmes,Government managers - education policy development & program administration,,4,743,2011,38,,O
747,"0414",Other managers in public administration,Autres gestionnaires de la fonction publique,Other managers in public administration,,4,743,2011,39,,O
748,"05",Specialized Middle Management Occupations,,Specialized middle management occupations,,2,708,2011,40,,
749,"051","Managers in art, culture, recreation and sport							 ",,"Managers in art, culture, recreation & sport        ",,3,748,2011,41,,
750,"0511","Library, archive, museum and art gallery managers","Directeurs/directrices de bibliothèques, des archives, de musées et de galeries d'art","Library, archive, museum & art gallery managers",,4,749,2011,42,,O
751,"0512","Managers - publishing, motion pictures, broadcasting and performing arts","Directeurs/directrices - édition, cinéma, radiotélédiffusion et arts de la scène","Managers - publishing, motion pictures, broadcasting & performing arts",,4,749,2011,43,,O
752,"0513","Recreation, sports and fitness program and service directors","Directeurs/directrices de programmes et de services de sports, de loisirs et de conditionnement physique","Recreation, sports & fitness program & service directors",,4,749,2011,44,,O
753,"06",Middle management occupations in retail and wholesale trade and customer services,,Middle management occupations in retail & wholesale trade & customer services,,2,708,2011,45,,
754,"060",Corporate sales managers										 ,,Corporate sales managers           ,,3,753,2011,46,,
755,"0124","Advertising, marketing and public relations managers","Directeurs/directrices de la publicité, du marketing et des relations publiques","Advertising, marketing & public relations managers",,4,723,2011,47,,O
756,"0601",Corporate sales managers,Directeurs/directrices des ventes corporatives,Corporate sales managers,,4,754,2011,47,,O
757,"062",Retail and wholesale trade managers								 ,,Retail & wholesale trade managers         ,,3,753,2011,48,,
758,"0621",Retail and wholesale trade managers,Directeurs/directrices - commerce de détail et de gros,Retail & wholesale trade managers,,4,757,2011,49,,A
759,"063",Managers in food service and accommodation							 ,,Managers in food service & accommodation        ,,3,753,2011,50,,
760,"0631",Restaurant and food service managers,Directeurs/directrices de la restauration et des services alimentaires,Restaurant & food service managers,,4,759,2011,51,,B
761,"0632",Accommodation service managers,Directeurs/directrices des services d'hébergement,Accommodation service managers,,4,759,2011,52,,O
762,"043",Managers in public protection services								 ,,Managers in public protection services         ,,3,742,2011,53,,
763,"0431",Commissioned police officers,Officiers/officières de direction des services de police,Commissioned police officers,,4,762,2011,54,,A
764,"0432",Fire chiefs and senior firefighting officers,Chefs et officiers supérieurs/officières supérieures des services d'incendie,Fire chiefs & senior firefighting officers,,4,762,2011,55,,A
765,"0433",Commissioned officers of the Canadian Armed Forces,Officiers/officières de direction des Forces armées canadiennes,Commissioned officers of the canadian forces,,4,762,2011,56,,O
766,"065","Managers in customer and personal services, n.e.c.						 ",,"Managers in customer & personal services, n.e.c.       ",,3,753,2011,57,,
767,"0651","Managers in customer and personal services, n.e.c.","Directeurs/directrices du service à la clientèle et des services personnels, n.c.a.","Managers in customer & personal services, n.e.c.",,4,766,2011,58,,A
768,"07","Middle management occupations in trades, transportation, production and utilities",,"Middle management occupations in trades, transportation, production & utilities",,2,708,2011,59,,
769,"071",Managers in construction and facility operation and maintenance					 ,,Managers in construction & facility operation & maintenance      ,,3,768,2011,60,,
770,"0711",Construction managers,Directeurs/directrices de la construction,Construction managers,,4,769,2011,61,,A
771,"0712",Home building and renovation managers,Gestionnaires en construction et rénovation domiciliaire,Home building & renovation managers,,4,769,2011,62,,A
772,"0731",Managers in transportation,Directeurs/directrices des transports,Managers in transportation,,4,773,2011,63,,A
773,"073",Managers in transportation									 ,,Managers in transportation          ,,3,768,2011,64,,
774,"0714",Facility operation and maintenance managers,Directeurs/directrices de l'exploitation et de l'entretien d'immeubles,Facility operation & maintenance managers,,4,769,2011,65,,A
775,"08","Middle management occupations in trades, transportation, production and utilities",,"Middle management occupations in trades, transportation, production & utilities",,2,708,2011,66,,
776,"081",Managers in natural resources production and fishing						 ,,Managers in natural resources production & fishing       ,,3,775,2011,67,,
777,"0811",Managers in natural resources production and fishing,Directeurs/directrices de l'exploitation des ressources naturelles et de la pêche,Managers in natural resources production & fishing,,4,776,2011,68,,O
778,"09","Middle management occupations in trades, transportation, production and utilities",,"Middle management occupations in trades, transportation, production & utilities",,2,708,2011,69,,
779,"091",Managers in manufacturing and utilities								 ,,Managers in manufacturing & utilities         ,,3,778,2011,70,,
780,"0911",Manufacturing managers,Directeurs/directrices de la fabrication,Manufacturing managers,,4,779,2011,71,,A
781,"0912",Utilities managers,Directeurs/directrices des services d'utilité publique,Utilities managers,,4,779,2011,72,,O
782,"1","Business, finance and administration occupations",,"Business, finance & administration occupations",,1,,2011,73,,
783,"11",Professional occupations in business and finance,,Professional occupations in business & finance,,2,782,2011,74,,
784,"111","Auditors, accountants and investment professionals						 ",,"Auditors, accountants & investment professionals       ",,3,783,2011,75,,
785,"1111",Financial auditors and accountants,Vérificateurs/vérificatrices et comptables,Financial auditors & accountants,,4,784,2011,76,,O
786,"1112",Financial and investment analysts,Analystes financiers/analystes financières et analystes en placements,Financial & investment analysts,,4,784,2011,77,,O
787,"1113","Securities agents, investment dealers and brokers","Agents/agentes en valeurs, agents/agentes en placements et négociateurs/négociatrices en valeurs","Securities agents, investment dealers & brokers",,4,784,2011,78,,O
788,"1114",Other financial officers,Autres agents financiers/agentes financières,Other financial officers,,4,784,2011,79,,O
789,"112",Human resources and business service professionals						 ,,Human resources & business service professionals       ,,3,783,2011,80,,
790,"1121",Human resources professionals,Professionnels/professionnelles en ressources humaines,Human resources professionals,,4,789,2011,81,,O
791,"1122",Professional occupations in business management consulting,Professionnels/professionnelles des services-conseils en gestion aux entreprises,Professional occupations in business management consulting,,4,789,2011,82,,O
792,"12",Administrative and financial supervisors and administrative occupations,,Administrative & financial supervisors & administrative occupations,,2,782,2011,83,,
793,"13","Finance, insurance and related business administrative occupations",,"Finance, insurance & related business administrative occupations",,2,782,2011,83,,
794,"121",Administrative services supervisors								 ,,Administrative services supervisors         ,,3,792,2011,84,,
795,"125","Court reporters, transcriptionists, records management technicians and statistical officers	 ",,"Court reporters, transcriptionists, records management technicians & statistical officers  ",,3,792,2011,84,,
796,"1211","Supervisors, general office and administrative support workers",Superviseurs/superviseures de commis de bureau et du personnel de soutien administratif,"Supervisors, general office & administrative support workers",,4,794,2011,85,,A
797,"1252",Health information management occupations,Professionnels/professionnelles de la gestion de l'information sur la santé,Health information management occupations,,4,795,2011,85,,A
798,"1212","Supervisors, finance and insurance office workers",Superviseurs/superviseures de commis de finance et d'assurance,"Supervisors, finance & insurance office workers",,4,794,2011,86,,O
799,"6314",Customer and information services supervisors,Superviseurs/superviseures des services d'information et des services à la clientèle,Customer & information services supervisors,,4,1117,2011,86,,A
800,"1213","Supervisors, library, correspondence and related information workers","Superviseurs/superviseures de commis de bibliothèque, de correspondanciers et d'autres commis à l'information","Supervisors, library, correspondence & related information workers",,4,794,2011,87,,O
801,"1214","Supervisors, mail and message distribution occupations",Superviseurs/superviseures de services postaux et de messageries,"Supervisors, mail & message distribution occupations",,4,794,2011,88,,A
802,"1215","Supervisors, supply chain, tracking and scheduling co-ordination occupations","Superviseurs/superviseures du personnel de coordination de la chaîne d'approvisionnement, du suivi et des horaires","Supervisors, supply chain, tracking & scheduling co-ordination occupations",,4,794,2011,89,,A
803,"122",Administrative and regulatory occupations								 ,,Administrative & regulatory occupations         ,,3,792,2011,90,,
804,"1221",Administrative officers,Agents/agentes d'administration,Administrative officers,,4,803,2011,91,,A
805,"1222",Executive assistants,Adjoints/adjointes de direction,Executive assistants,,4,803,2011,92,,O
806,"1223",Human resources and recruitment officers,Agents/agentes des ressources humaines et de recrutement,Human resources & recruitment officers,,4,803,2011,93,,O
807,"1224",Property administrators,Agents/agentes de gestion immobilière,Property administrators,,4,803,2011,94,,A
808,"1225",Purchasing agents and officers,Agents/agentes aux achats,Purchasing agents & officers,,4,803,2011,95,,O
809,"1226",Conference and event planners,Planificateurs/planificatrices de congrès et d'événements,Conference & event planners,,4,803,2011,96,,O
810,"1227",Court officers and justices of the peace,Juges de paix et officiers/officières de justice,Court officers & justices of the peace,,4,803,2011,97,,A
811,"1228","Employment insurance, immigration, border services and revenue officers","Agents/agentes d'assurance-emploi, d'immigration, de services frontaliers et du revenu","Employment insurance, immigration, border services & revenue officers",,4,803,2011,98,,O
812,"131","Finance, insurance and related business administrative occupations				 ",,"Finance, insurance & related business administrative occupations     ",,3,793,2011,99,,
813,"1311",Accounting technicians and bookkeepers,Techniciens/techniciennes en comptabilité et teneurs/teneuses de livres,Accounting technicians & bookkeepers,,4,812,2011,100,,A
814,"6235",Financial sales representatives,Représentants/représentantes des ventes financières,Financial sales representatives,,4,1087,2011,101,,O
815,"1312",Insurance adjusters and claims examiners,Experts/expertes en sinistres et rédacteurs/rédactrices sinistres,Insurance adjusters & claims examiners,,4,812,2011,102,,A
816,"1313",Insurance underwriters,Assureurs/assureures,Insurance underwriters,,4,812,2011,103,,O
817,"1314","Assessors, valuators and appraisers",Estimateurs/estimatrices et évaluateurs/évaluatrices,"Assessors, valuators & appraisers",,4,812,2011,104,,O
818,"1315","Customs, ship and other brokers","Courtiers/courtières en douanes, courtiers maritimes/courtières maritimes et autres courtiers/courtières","Customs, ship & other brokers",,4,812,2011,105,,A
819,"124","Office administrative assistants - general, legal and medical					 ",,"Office administrative assistants - general, legal & medical      ",,3,792,2011,106,,
820,"1241",Administrative assistants,Adjoints administratifs/adjointes administratives,Administrative assistants,,4,819,2011,107,,A
821,"1242",Legal administrative assistants,Adjoints administratifs juridiques/adjointes administratives juridiques,Legal administrative assistants,,4,819,2011,108,,A
822,"1243",Medical administrative assistants,Adjoints administratifs médicaux/adjointes administratives médicales,Medical administrative assistants,,4,819,2011,109,,A
823,"1251","Court reporters, medical transcriptionists and related occupations","Sténographes judiciaires, transcripteurs médicaux/transcriptrices médicales et personnel assimilé","Court reporters, medical transcriptionists & related occupations",,4,795,2011,110,,A
824,"14",Office support occupations,,Office support occupations,,2,782,2011,111,,
825,"15","Distribution, tracking and scheduling co-ordination occupations",,"Distribution, tracking & scheduling co-ordination occupations",,2,782,2011,111,,
826,"141",General office workers										 ,,General office workers           ,,3,824,2011,112,,
827,"1411",General office support workers,Employés de soutien de bureau généraux/employées de soutien de bureau générales,General office support workers,,4,826,2011,113,,A
828,"1253",Records management technicians,Techniciens/techniciennes à la gestion des documents,Records management technicians,,4,795,2011,114,,A
829,"1414",Receptionists,Réceptionnistes,Receptionists,,4,826,2011,115,,A
830,"142",Office equipment operators									 ,,Office equipment operators          ,,3,824,2011,116,,
831,"1422",Data entry clerks,Commis à la saisie de données,Data entry clerks,,4,830,2011,117,,A
832,"1423",Desktop publishing operators and related occupations,Opérateurs/opératrices d'équipement d'éditique et personnel assimilé,Desktop publishing operators & related occupations,,4,830,2011,118,,A
833,"143","Financial, insurance and related administrative support workers					 ",,"Financial, insurance & related administrative support workers      ",,3,824,2011,120,,
834,"655",Customer and information services representatives							,,Customer & information services representatives       ,,3,1105,2011,120,,
835,"1431",Accounting and related clerks,Commis à la comptabilité et personnel assimilé,Accounting & related clerks,,4,833,2011,121,,A
836,"1432",Payroll administrators,Administrateurs/administratrices de la paye,Payroll clerks,,4,833,2011,122,,A
837,"6551",Customer services representatives - financial institutions,Représentants/représentantes au service à la clientèle - institutions financières,Customer services representatives - financial institutions,,4,834,2011,123,,A
838,"1434","Banking, insurance and other financial clerks","Commis de banque, d'assurance et d'autres services financiers","Banking, insurance & other financial clerks",,4,833,2011,124,,O
839,"1435",Collectors,Agents/agentes de recouvrement,Collectors,,4,833,2011,125,,A
840,"1415",Personnel clerks,Commis des services du personnel,Personnel clerks,,4,826,2011,128,,O
841,"1416",Court clerks,Commis des services judiciaires,Court clerks,,4,826,2011,129,,A
842,"145","Library, correspondence and other clerks								 ",,"Library, correspondence & other clerks         ",,3,824,2011,130,,
843,"1451",Library assistants and clerks,Commis et assistants/assistantes dans les bibliothèques,Library assistants & clerks,,4,842,2011,131,,O
844,"1452","Correspondence, publication and regulatory clerks",Correspondanciers/correspondancières et commis aux publications et aux règlements,"Correspondence, publication & regulatory clerks",,4,842,2011,132,,O
845,"6552",Other customer and information services representatives,Autres préposés/autres préposées aux services d'information et aux services à la clientèle,Other customer & information services representatives,,4,834,2011,133,,A
846,"1454",Survey interviewers and statistical clerks,Intervieweurs/intervieweuses pour enquêtes et commis aux statistiques,Survey interviewers & statistical clerks,,4,842,2011,134,,A
847,"151",Mail and message distribution occupations								 ,,Mail & message distribution occupations         ,,3,825,2011,135,,
848,"1511","Mail, postal and related workers",Commis au courrier et aux services postaux et personnel assimilé,"Mail, postal & related workers",,4,847,2011,136,,B
849,"1512",Letter carriers,Facteurs/factrices,Letter carriers,,4,847,2011,137,,B
850,"1513","Couriers, messengers and door-to-door distributors",Messagers/messagères et distributeurs/distributrices porte-à-porte,"Couriers, messengers & door-to-door distributors",,4,847,2011,138,,B
851,"152","Supply chain logistics, tracking and scheduling co-ordination occupations				 ",,"Supply chain logistics, tracking & scheduling co-ordination occupations     ",,3,825,2011,139,,
852,"1521",Shippers and receivers,Expéditeurs/expéditrices et réceptionnaires,Shippers & receivers,,4,851,2011,140,,B
853,"1522",Storekeepers and partspersons,Magasiniers/magasinières et commis aux pièces,Storekeepers & partspersons,,4,851,2011,141,,D
854,"1523",Production logistics co-ordinators,Coordonnateurs/coordonnatrices de la logistique de la production,Production logistics co-ordinators,,4,851,2011,142,,A
855,"1524",Purchasing and inventory control workers,Commis aux achats et au contrôle de l'inventaire,Purchasing & inventory control workers,,4,851,2011,143,,A
856,"1525",Dispatchers,Répartiteurs/répartitrices,Dispatchers,,4,851,2011,144,,A
857,"1526",Transportation route and crew schedulers,Horairistes de trajets et d'équipages,Transportation route & crew schedulers,,4,851,2011,145,,A
858,"2",Natural and applied sciences and related occupations,,Natural & applied sciences & related occupations,,1,,2011,146,,
859,"21",Professional occupations in natural and applied sciences,,Professional occupations in natural & applied sciences,,2,858,2011,147,,
860,"211",Physical science professionals									 ,,Physical science professionals          ,,3,859,2011,148,,
861,"2111",Physicists and astronomers,Physiciens/physiciennes et astronomes,Physicists & astronomers,,4,860,2011,149,,O
862,"2112",Chemists,Chimistes,Chemists,,4,860,2011,150,,O
863,"2113",Geoscientists and oceanographers,Géoscientifiques et océanographes,Geoscientists & oceanographers,,4,860,2011,151,,O
864,"2114",Meteorologists and climatologists,Météorologues et climatologues,Meteorologists & climatologists,,4,860,2011,152,,O
865,"2115",Other professional occupations in physical sciences,Autres professionnels/professionnelles des sciences physiques,Other professional occupations in physical sciences,,4,860,2011,153,,O
866,"212",Life science professionals									 ,,Life science professionals          ,,3,859,2011,154,,
867,"2121",Biologists and related scientists,Biologistes et personnel scientifique assimilé,Biologists & related scientists,,4,866,2011,155,,O
868,"2122",Forestry professionals,Professionnels/professionnelles des sciences forestières,Forestry professionals,,4,866,2011,156,,O
869,"2123","Agricultural representatives, consultants and specialists","Agronomes, conseillers/conseillères et spécialistes en agriculture","Agricultural representatives, consultants & specialists",,4,866,2011,157,,O
870,"213","Civil, mechanical, electrical and chemical engineers						 ",,"Civil, mechanical, electrical & chemical engineers       ",,3,859,2011,158,,
871,"2131",Civil engineers,Ingénieurs civils/ingénieures civiles,Civil engineers,,4,870,2011,159,,O
872,"2132",Mechanical engineers,Ingénieurs mécaniciens/ingénieures mécaniciennes,Mechanical engineers,,4,870,2011,160,,O
873,"2133",Electrical and electronics engineers,Ingénieurs électriciens et électroniciens/ingénieures électriciennes et électroniciennes,Electrical & electronics engineers,,4,870,2011,161,,O
874,"2134",Chemical engineers,Ingénieurs chimistes/ingénieures chimistes,Chemical engineers,,4,870,2011,162,,O
875,"214",Other engineers											 ,,Other engineers            ,,3,859,2011,163,,
876,"2141",Industrial and manufacturing engineers,Ingénieurs/ingénieures d'industrie et de fabrication,Industrial & manufacturing engineers,,4,875,2011,164,,O
877,"2142",Metallurgical and materials engineers,Ingénieurs/ingénieures métallurgistes et des matériaux,Metallurgical & materials engineers,,4,875,2011,165,,O
878,"2143",Mining engineers,Ingénieurs miniers/ingénieures minières,Mining engineers,,4,875,2011,166,,O
879,"2144",Geological engineers,Ingénieurs géologues/ingénieures géologues,Geological engineers,,4,875,2011,167,,O
880,"2145",Petroleum engineers,Ingénieurs/ingénieures de l'extraction et du raffinage du pétrole,Petroleum engineers,,4,875,2011,168,,O
881,"2146",Aerospace engineers,Ingénieurs/ingénieures en aérospatiale,Aerospace engineers,,4,875,2011,169,,O
882,"2147",Computer engineers (except software engineers and designers),Ingénieurs informaticiens/ingénieures informaticiennes (sauf ingénieurs/ingénieures et concepteurs/conceptrices en logiciel),Computer engineers (except software engineers & designers),,4,875,2011,170,,O
883,"2148","Other professional engineers, n.e.c.","Autres ingénieurs/ingénieures, n.c.a.","Other professional engineers, n.e.c.",,4,875,2011,171,,O
884,"215","Architects, urban planners and land surveyors							 ",,"Architects, urban planners & land surveyors        ",,3,859,2011,172,,
885,"2151",Architects,Architectes,Architects,,4,884,2011,173,,O
886,"2152",Landscape architects,Architectes paysagistes,Landscape architects,,4,884,2011,174,,O
887,"2153",Urban and land use planners,Urbanistes et planificateurs/planificatrices de l'utilisation des sols,Urban & land use planners,,4,884,2011,175,,O
888,"2154",Land surveyors,Arpenteurs-géomètres/arpenteuses-géomètres,Land surveyors,,4,884,2011,176,,A
889,"216","Mathematicians, statisticians and actuaries							 ",,"Mathematicians, statisticians & actuaries        ",,3,859,2011,177,,
890,"1254",Statistical officers and related research support occupations,Agents/agentes de statistiques et professions connexes du soutien de la recherche,Statistical officers & related research support occupations,,4,795,2011,178,,O
891,"2161","Mathematicians, statisticians and actuaries","Mathématiciens/mathématiciennes, statisticiens/statisticiennes et actuaires","Mathematicians, statisticians & actuaries",,4,889,2011,178,,O
892,"217",Computer and information systems professionals							 ,,Computer & information systems professionals        ,,3,859,2011,179,,
893,"2171",Information systems analysts and consultants,Analystes et consultants/consultantes en informatique,Information systems analysts & consultants,,4,892,2011,180,,O
894,"2172",Database analysts and data administrators,Analystes de bases de données et administrateurs/administratrices de données,Database analysts & data administrators,,4,892,2011,181,,O
895,"2173",Software engineers and designers,Ingénieurs/ingénieures et concepteurs/conceptrices en logiciel,Software engineers & designers,,4,892,2011,182,,O
896,"2174",Computer programmers and interactive media developers,Programmeurs/programmeuses et développeurs/développeuses en médias interactifs,Computer programmers & interactive media developers,,4,892,2011,183,,O
897,"2175",Web designers and developers,Concepteurs/conceptrices et développeurs/développeuses Web,Web designers & developers,,4,892,2011,184,,O
898,"22",Technical occupations related to natural and applied sciences,,Technical occupations related to natural & applied sciences,,2,858,2011,185,,
899,"221",Technical occupations in physical sciences							 ,,Technical occupations in physical sciences        ,,3,898,2011,186,,
900,"2211",Chemical technologists and technicians,Technologues et techniciens/techniciennes en chimie,Chemical technologists & technicians,,4,899,2011,187,,O
901,"2212",Geological and mineral technologists and technicians,Technologues et techniciens/techniciennes en géologie et en minéralogie,Geological & mineral technologists & technicians,,4,899,2011,188,,A
