"NOC_ID","NOCCode","NameEnglish","NameFrench","EnglishShortAlias","NOCS2006","NOCGroupTypeID","ParentNOC_ID","NOCYear","NOC_ID2006","TradesOutlookNOC","SkillLevel"
1,"0",Management occupations,Gestion,,,1,,2006,,,
2,"00",Senior Management Occupations,Cadres supérieurs/cadres supérieures,,,2,1,2006,,,
3,"001",Legislators and Senior Management,Membres des corps législatifs et cadres supérieurs/cadres supérieures,,A01,3,2,2006,,,
4,"0011",Legislators,Membres des corps législatifs,,A011,4,3,2006,,,
5,"0012",Senior government managers and officials,Cadres supérieurs/cadres supérieures - administration publique,,A012,4,3,2006,,,
6,"0013","Senior managers - financial, communications and other business services","Cadres supérieurs/cadres supérieures - services financiers, communications et autres services aux entreprises",,A013,4,3,2006,,,
7,"0014","Senior managers - health, education, social and community services and membership organizations","Cadres supérieurs/cadres supérieures - santé, enseignement, services sociaux et communautaires et associations mutuelles",,A014,4,3,2006,,,
8,"0015","Senior managers - trade, broadcasting and other services, n.e.c.","Cadres supérieurs/cadres supérieures - commerce, radiotélédiffusion et autres services, n.c.a.",,A015,4,3,2006,,,
9,"0016","Senior managers - construction, transportation, production and utilities","Cadres supérieurs/cadres supérieures - construction, transport, production et services d'utilité publique",,A016,4,3,2006,,,
10,"01",Middle and Other Management Occupations,Cadres intermédiaires et autre personnel de gestion,,,2,1,2006,,,
11,"011",Administrative Services Managers,Directeurs/directrices des services administratifs,,A11,3,10,2006,,,
12,"0111",Financial managers,Directeurs financiers/directrices financières,,A111,4,11,2006,,,
13,"0112",Human resources managers,Directeurs/directrices des ressources humaines,,A112,4,11,2006,,,
14,"0113",Purchasing managers,Directeurs/directrices des achats,,A113,4,11,2006,,,
15,"0114",Other administrative services managers,Directeurs/directrices d'autres services administratifs,,A114,4,11,2006,,,
16,"012",Managers in Financial and Business Services,Directeurs/directrices des services financiers et des services aux entreprises,,A30,3,10,2006,,,
17,"0121","Insurance, real estate and financial brokerage managers","Directeurs/directrices des assurances, de l'immobilier et du courtage financier",,A301,4,16,2006,,,
18,"0122","Banking, credit and other investment managers","Directeurs/directrices de banque, du crédit et d'autres services de placements",,A302,4,16,2006,,,
19,"0123",Other Business Services Managers,Directeurs/directrices d'autres services aux entreprises,,A303,4,16,2006,,,
20,"013",Managers in Communication (Except Broadcasting),Directeurs/directrices des services de communications (sauf la radiotélédiffusion),,A31,3,10,2006,,,
21,"0131",Telecommunication carriers managers,Directeurs/directrices d'entreprises de télécommunications,,A311,4,20,2006,,,
22,"0132",Postal and courier services managers,Directeurs/directrices des services postaux et de messageries,,A312,4,20,2006,,,
23,"02",Middle and Other Management Occupations,Cadres intermédiaires et autre personnel de gestion,,,2,1,2006,,,
24,"021","Managers in Engineering, Architecture, Science and Information Systems","Directeurs/directrices des services de génie, d'architecture, de sciences naturelles et des systèmes informatiques",,A12,3,23,2006,,,
25,"0211",Engineering managers,Directeurs/directrices des services de génie,,A121,4,24,2006,,,
26,"0212",Architecture and science managers,Directeurs/directrices des services d'architecture et de sciences,,A123,4,24,2006,,,
27,"0213",Computer and information systems managers,Gestionnaires des systèmes informatiques,,A122,4,24,2006,,,
28,"03",Middle and Other Management Occupations,Cadres intermédiaires et autre personnel de gestion,,,2,1,2006,,,
29,"031","Managers in Health, Education, Social and Community Services","Directeurs/directrices des secteurs de la santé, de l'enseignement et des services communautaires et sociaux",,A32,3,28,2006,,,
30,"0311",Managers in health care,Directeurs/directrices des soins de santé,,A321,4,29,2006,,,
31,"0312",Administrators - Post-Secondary Education and Vocational Training,Administrateurs/administratrices - enseignement postsecondaire et formation professionnelle,,A322,4,29,2006,,,
32,"0313",School Principals and Administrators of Elementary and Secondary Education,Directeurs/directrices d'école et administrateurs/administratrices de programmes d'enseignement aux niveaux primaire et secondaire,,A323,4,29,2006,,,
33,"0314","Managers in Social, Community and Correctional Services","Directeurs/directrices des services sociaux, communautaires et correctionnels",,A324,4,29,2006,,,
34,"04",Middle and Other Management Occupations,Cadres intermédiaires et autre personnel de gestion,,,2,1,2006,,,
35,"041",Managers in Public Administration,Directeurs/directrices de la fonction publique,,A33,3,34,2006,,,
36,"0411",Government managers - health and social policy development and program administration,Gestionnaires de la fonction publique - élaboration de politiques et administration de programmes sociaux et de santé,,A331,4,35,2006,,,
37,"0412","Government managers - economic analysis, policy development and program administration","Gestionnaires de la fonction publique - analyse économique, élaboration de politiques et administration de programmes",,A332,4,35,2006,,,
38,"0413",Government managers - education policy development and program administration,Gestionnaires de la fonction publique - élaboration de politiques en matière d'éducation et administration de programmes,,A333,4,35,2006,,,
39,"0414",Other managers in public administration,Autres gestionnaires de la fonction publique,,A334,4,35,2006,,,
40,"05",Middle and Other Management Occupations,Cadres intermédiaires et autre personnel de gestion,,,2,1,2006,,,
41,"051","Managers in Art, Culture, Recreation and Sport","Directeurs/directrices des arts, de la culture, des sports et des loisirs",,A34,3,40,2006,,,
42,"0511","Library, archive, museum and art gallery managers","Directeurs/directrices de bibliothèques, des archives, de musées et de galeries d'art",,A341,4,41,2006,,,
43,"0512","Managers - publishing, motion pictures, broadcasting and performing arts","Directeurs/directrices - édition, cinéma, radiotélédiffusion et arts de la scène",,A342,4,41,2006,,,
44,"0513","Recreation, sports and fitness program and service directors","Directeurs/directrices de programmes et de services de sports, de loisirs et de conditionnement physique",,A343,4,41,2006,,,
45,"06",Middle and Other Management Occupations,Cadres intermédiaires et autre personnel de gestion,,,2,1,2006,,,
46,"061","Sales, Marketing and Advertising Managers","Directeurs/directrices des ventes, du marketing et de la publicité",,A13,3,45,2006,,,
47,"0611","Sales, Marketing and Advertising Managers","Directeurs/directrices des ventes, du marketing et de la publicité",,A131,4,46,2006,,,
48,"062",Managers in Retail Trade,Directeurs/directrices - commerce de détail,,A21,3,45,2006,,,
49,"0621",Retail and wholesale trade managers,Directeurs/directrices - commerce de détail et de gros,,A211,4,48,2006,,,
50,"063",Managers in Food Service and Accommodation,Directeurs/directrices de la restauration et des services d'hébergement,,A22,3,45,2006,,,
51,"0631",Restaurant and food service managers,Directeurs/directrices de la restauration et des services alimentaires,,A221,4,50,2006,,,
52,"0632",Accommodation service managers,Directeurs/directrices des services d'hébergement,,A222,4,50,2006,,,
53,"064",Managers in Protective Service,Directeurs/directrices des services de protection,,A35,3,45,2006,,,
54,"0641",Commissioned Police Officers,Officiers/officières de direction des services de police,,A351,4,53,2006,,,
55,"0642",Fire Chiefs and Senior Firefighting Officers,Chefs et officiers supérieurs/officières supérieures des services d'incendie,,A352,4,53,2006,,,
56,"0643","Commissioned Officers, Armed Forces",Officiers/officières de direction des Forces armées,,A353,4,53,2006,,,
57,"065",Managers in Other Services,Directeurs/directrices d'autres services,,A36,3,45,2006,,,
58,"0651","Managers in customer and personal services, n.e.c.","Directeurs/directrices du service à la clientèle et des services personnels, n.c.a.",,A361,4,57,2006,,,
59,"07",Middle and Other Management Occupations,Cadres intermédiaires et autre personnel de gestion,,,2,1,2006,,,
60,"071",Managers in Construction and Transportation,Directeurs/directrices de la construction et du transport,,A37,3,59,2006,,,
61,"0711",Construction managers,Directeurs/directrices de la construction,,A371,4,60,2006,,,
62,"0712",Home building and renovation managers,Gestionnaires en construction et rénovation domiciliaire,,A372,4,60,2006,,,
63,"0713",Transportation Managers,Directeurs/directrices des transports,,A373,4,60,2006,,,
64,"072",Facility Operation and Maintenance Managers,Directeurs/directrices de l'exploitation et de l'entretien d'immeubles,,A14,3,59,2006,,,
65,"0721",Facility Operation and Maintenance Managers,Directeurs/directrices de l'exploitation et de l'entretien d'immeubles,,A141,4,64,2006,,,
66,"08",Middle and Other Management Occupations,Cadres intermédiaires et autre personnel de gestion,,,2,1,2006,,,
67,"081",Managers in Primary Production (Except Agriculture),Directeurs/directrices de la production primaire (sauf l'agriculture),,A38,3,66,2006,,,
68,"0811",Managers in natural resources production and fishing,Directeurs/directrices de l'exploitation des ressources naturelles et de la pêche,,A381,4,67,2006,,,
69,"09",Middle and Other Management Occupations,Cadres intermédiaires et autre personnel de gestion,,,2,1,2006,,,
70,"091",Managers in Manufacturing and Utilities,Directeurs/directrices de la fabrication et des services d'utilité publique,,A39,3,69,2006,,,
71,"0911",Manufacturing managers,Directeurs/directrices de la fabrication,,A391,4,70,2006,,,
72,"0912",Utilities managers,Directeurs/directrices des services d'utilité publique,,A392,4,70,2006,,,
73,"1","Business, finance and administration occupations","Affaires, finance et administration",,,1,,2006,,,
74,"11",Professional Occupations in Business and Finance,Personnel professionnel en gestion des affaires et en finance,,,2,73,2006,,,
75,"111","Auditors, Accountants and Investment Professionals","Professionnels/professionnelles en finance, en vérification et en comptabilité",,B01,3,74,2006,,,
76,"1111",Financial auditors and accountants,Vérificateurs/vérificatrices et comptables,,B011,4,75,2006,,,
77,"1112",Financial and investment analysts,Analystes financiers/analystes financières et analystes en placements,,B012,4,75,2006,,,
78,"1113","Securities agents, investment dealers and brokers","Agents/agentes en valeurs, agents/agentes en placements et négociateurs/négociatrices en valeurs",,B013,4,75,2006,,,
79,"1114",Other financial officers,Autres agents financiers/agentes financières,,B014,4,75,2006,,,
80,"112",Human Resources and Business Service Professionals,Professionnels/professionnelles en gestion des ressources humaines et en services aux entreprises,,B02,3,74,2006,,,
81,"1121",Human resources professionals,Professionnels/professionnelles en ressources humaines,,B021,4,80,2006,,,
82,"1122",Professional occupations in business management consulting,Professionnels/professionnelles des services-conseils en gestion aux entreprises,,B022,4,80,2006,,,
83,"12",Skilled Administrative and Business Occupations,Personnel spécialisé en administration et en travail de bureau,,,2,73,2006,,,
84,"121",Clerical Supervisors,Personnel de supervision du travail de bureau,,B41,3,83,2006,,,
85,"1211","Supervisors, general office and administrative support workers",Superviseurs/superviseures de commis de bureau et du personnel de soutien administratif,,B411,4,84,2006,,,
86,"1212","Supervisors, finance and insurance office workers",Superviseurs/superviseures de commis de finance et d'assurance,,B412,4,84,2006,,,
87,"1213","Supervisors, library, correspondence and related information workers","Superviseurs/superviseures de commis de bibliothèque, de correspondanciers et d'autres commis à l'information",,B413,4,84,2006,,,
88,"1214","Supervisors, mail and message distribution occupations",Superviseurs/superviseures de services postaux et de messageries,,B414,4,84,2006,,,
89,"1215","Supervisors, supply chain, tracking and scheduling co-ordination occupations","Superviseurs/superviseures du personnel de coordination de la chaîne d'approvisionnement, du suivi et des horaires",,B415,4,84,2006,,,
90,"122",Administrative and Regulatory Occupations,Personnel administratif et de réglementation,,B31,3,83,2006,,,
91,"1221",Administrative officers,Agents/agentes d'administration,,B311,4,90,2006,,,
92,"1222",Executive assistants,Adjoints/adjointes de direction,,B312,4,90,2006,,,
93,"1223",Human resources and recruitment officers,Agents/agentes des ressources humaines et de recrutement,,B313,4,90,2006,,,
94,"1224",Property administrators,Agents/agentes de gestion immobilière,,B314,4,90,2006,,,
95,"1225",Purchasing agents and officers,Agents/agentes aux achats,,B315,4,90,2006,,,
96,"1226",Conference and event planners,Planificateurs/planificatrices de congrès et d'événements,,B316,4,90,2006,,,
97,"1227",Court officers and justices of the peace,Juges de paix et officiers/officières de justice,,B317,4,90,2006,,,
98,"1228","Employment insurance, immigration, border services and revenue officers","Agents/agentes d'assurance-emploi, d'immigration, de services frontaliers et du revenu",,B318,4,90,2006,,,
99,"123",Finance and Insurance Administrative Occupations,Personnel d'administration des finances et des assurances,,B11,3,83,2006,,,
100,"1231",Bookkeepers,Teneurs/teneuses de livres,,B111,4,99,2006,,,
101,"1232",Loan Officers,Agents/agentes de prêts,,B112,4,99,2006,,,
102,"1233",Insurance Adjusters and Claims Examiners,Experts/expertes en sinistres et rédacteurs/rédactrices sinistres,,B113,4,99,2006,,,
103,"1234",Insurance Underwriters,Assureurs/assureures,,B114,4,99,2006,,,
104,"1235","Assessors, Valuators and Appraisers",Estimateurs/estimatrices et évaluateurs/évaluatrices,,B115,4,99,2006,,,
105,"1236","Customs, Ship and Other Brokers","Courtiers/courtières en douanes, courtiers/courtières maritimes et autres courtiers/courtières",,B116,4,99,2006,,,
106,"124","Secretaries, Recorders and Transcriptionists",Personnel en secrétariat,,B21,3,83,2006,,,
107,"1241",Administrative assistants,Adjoints administratifs/adjointes administratives,,B211,4,106,2006,,,
108,"1242",Legal administrative assistants,Adjoints administratifs juridiques/adjointes administratives juridiques,,B212,4,106,2006,,,
109,"1243",Medical administrative assistants,Adjoints administratifs médicaux/adjointes administratives médicales,,B213,4,106,2006,,,
110,"1244",Court Recorders and Medical Transcriptionists,Rapporteurs/rapporteuses judiciaires et transcripteurs médicaux/transcriptrices médicales,,B214,4,106,2006,,,
111,"14",Clerical Occupations,Personnel de bureau,,,2,73,2006,,,
112,"141","Clerical Occupations, General Office Skills",Commis au travail général de bureau,,B51,3,111,2006,,,
113,"1411",General office support workers,Employés de soutien de bureau généraux/employées de soutien de bureau générales,,B511,4,112,2006,,,
114,"1413",Records Management and Filing Clerks,Commis au classement et à la gestion des documents,,B513,4,112,2006,,,
115,"1414",Receptionists,Réceptionnistes,,B514,4,112,2006,,,
116,"142",Office Equipment Operators,Commis en bureautique et en éditique,,B52,3,111,2006,,,
117,"1422",Data entry clerks,Commis à la saisie de données,,B522,4,116,2006,,,
118,"1423",Desktop publishing operators and related occupations,Opérateurs/opératrices d'équipement d'éditique et personnel assimilé,,B523,4,116,2006,,,
119,"1424",Telephone Operators,Téléphonistes,,B524,4,116,2006,,,
120,"143",Finance and Insurance Clerks,Commis des finances et de l'assurance,,B53,3,111,2006,,,
121,"1431",Accounting and related clerks,Commis à la comptabilité et personnel assimilé,,B531,4,120,2006,,,
122,"1432",Payroll administrators,Administrateurs/administratrices de la paye,,B532,4,120,2006,,,
123,"1433",Customer Service Representatives - Financial Services,Représentants/représentantes au service à la clientèle - services financiers,,B533,4,120,2006,,,
124,"1434","Banking, insurance and other financial clerks","Commis de banque, d'assurance et d'autres services financiers",,B534,4,120,2006,,,
125,"1435",Collectors,Agents/agentes de recouvrement,,B535,4,120,2006,,,
126,"144",Administrative Support Clerks,Commis de soutien administratif,,B54,3,111,2006,,,
127,"1441",Administrative Clerks,Commis de soutien administratif,,B541,4,126,2006,,,
128,"1442",Personnel Clerks,Commis des services du personnel,,B542,4,126,2006,,,
129,"1443",Court Clerks,Commis des services judiciaires,,B543,4,126,2006,,,
130,"145","Library, Correspondence and Related Information Clerks","Commis de bibliothèque, de correspondance et à l'information",,B55,3,111,2006,,,
131,"1451",Library assistants and clerks,Commis et assistants/assistantes dans les bibliothèques,,B551,4,130,2006,,,
132,"1452","Correspondence, publication and regulatory clerks",Correspondanciers/correspondancières et commis aux publications et aux règlements,,B552,4,130,2006,,,
133,"1453","Customer Service, Information and Related Clerks","Commis aux services à la clientèle, commis à l'information et personnel assimilé",,B553,4,130,2006,,,
134,"1454",Survey interviewers and statistical clerks,Intervieweurs/intervieweuses pour enquêtes et commis aux statistiques,,B554,4,130,2006,,,
135,"146",Mail and Message Distribution Occupations,Commis des services postaux et de messageries,,B56,3,111,2006,,,
136,"1461","Mail, Postal and Related Clerks",Commis au courrier et aux services postaux et personnel assimilé,,B561,4,135,2006,,,
137,"1462",Letter Carriers,Facteurs/factrices,,B562,4,135,2006,,,
138,"1463","Couriers, Messengers and Door-to-Door Distributors",Messagers/messagères et distributeurs/distributrices porte-à-porte,,B563,4,135,2006,,,
139,"147","Recording, Scheduling and Distributing Occupations",Commis à l'expédition et à la distribution,,B57,3,111,2006,,,
140,"1471",Shippers and Receivers,Expéditeurs/expéditrices et réceptionnaires,,B571,4,139,2006,,,
141,"1472",Storekeepers and Parts Clerks,Magasiniers/magasinières et commis aux pièces,,B572,4,139,2006,,,
142,"1473",Production Clerks,Commis à la production,,B573,4,139,2006,,,
143,"1474",Purchasing and Inventory Clerks,Commis aux achats et à l'inventaire,,B574,4,139,2006,,,
144,"1475",Dispatchers and Radio Operators,Répartiteurs/répartitrices et opérateurs radio/opératrices radio,,B575,4,139,2006,,,
145,"1476",Transportation Route and Crew Schedulers,Horairistes de trajets et préposés/préposées à l'affectation des équipages,,B576,4,139,2006,,,
146,"2",Natural and Applied Sciences and Related Occupations,Sciences naturelles et appliquées et domaines apparentés,,,1,,2006,,,
147,"21",Professional Occupations in Natural and Applied Sciences,Personnel professionnel des sciences naturelles et appliquées,,,2,146,2006,,,
148,"211",Physical Science Professionals,Professionnels/professionnelles des sciences physiques,,C01,3,147,2006,,,
149,"2111",Physicists and astronomers,Physiciens/physiciennes et astronomes,,C011,4,148,2006,,,
150,"2112",Chemists,Chimistes,,C012,4,148,2006,,,
151,"2113",Geoscientists and oceanographers,Géoscientifiques et océanographes,,C013,4,148,2006,,,
152,"2114",Meteorologists and climatologists,Météorologues et climatologues,,C014,4,148,2006,,,
153,"2115",Other professional occupations in physical sciences,Autres professionnels/professionnelles des sciences physiques,,C015,4,148,2006,,,
154,"212",Life Science Professionals,Professionnels/professionnelles des sciences de la vie,,C02,3,147,2006,,,
155,"2121",Biologists and related scientists,Biologistes et personnel scientifique assimilé,,C021,4,154,2006,,,
156,"2122",Forestry professionals,Professionnels/professionnelles des sciences forestières,,C022,4,154,2006,,,
157,"2123","Agricultural representatives, consultants and specialists","Agronomes, conseillers/conseillères et spécialistes en agriculture",,C023,4,154,2006,,,
158,"213","Civil, Mechanical, Electrical and Chemical Engineers","Professionnels/professionnelles en génie civil, mécanique, électrique et chimique",,C03,3,147,2006,,,
159,"2131",Civil engineers,Ingénieurs civils/ingénieures civiles,,C031,4,158,2006,,,
160,"2132",Mechanical engineers,Ingénieurs mécaniciens/ingénieures mécaniciennes,,C032,4,158,2006,,,
161,"2133",Electrical and electronics engineers,Ingénieurs électriciens et électroniciens/ingénieures électriciennes et électroniciennes,,C033,4,158,2006,,,
162,"2134",Chemical engineers,Ingénieurs chimistes/ingénieures chimistes,,C034,4,158,2006,,,
163,"214",Other Engineers,Autres professionnels/professionnelles en génie,,C04,3,147,2006,,,
164,"2141",Industrial and manufacturing engineers,Ingénieurs/ingénieures d'industrie et de fabrication,,C041,4,163,2006,,,
165,"2142",Metallurgical and materials engineers,Ingénieurs/ingénieures métallurgistes et des matériaux,,C042,4,163,2006,,,
166,"2143",Mining engineers,Ingénieurs miniers/ingénieures minières,,C043,4,163,2006,,,
167,"2144",Geological engineers,Ingénieurs géologues/ingénieures géologues,,C044,4,163,2006,,,
168,"2145",Petroleum engineers,Ingénieurs/ingénieures de l'extraction et du raffinage du pétrole,,C045,4,163,2006,,,
169,"2146",Aerospace engineers,Ingénieurs/ingénieures en aérospatiale,,C046,4,163,2006,,,
170,"2147",Computer engineers (except software engineers and designers),Ingénieurs informaticiens/ingénieures informaticiennes (sauf ingénieurs/ingénieures et concepteurs/conceptrices en logiciel),,C047,4,163,2006,,,
171,"2148","Other professional engineers, n.e.c.","Autres ingénieurs/ingénieures, n.c.a.",,C048,4,163,2006,,,
172,"215","Architects, Urban Planners and Land Surveyors","Professionnels/professionnelles en architecture, en urbanisme et en arpentage",,C05,3,147,2006,,,
173,"2151",Architects,Architectes,,C051,4,172,2006,,,
174,"2152",Landscape architects,Architectes paysagistes,,C052,4,172,2006,,,
175,"2153",Urban and land use planners,Urbanistes et planificateurs/planificatrices de l'utilisation des sols,,C053,4,172,2006,,,
176,"2154",Land surveyors,Arpenteurs-géomètres/arpenteuses-géomètres,,C054,4,172,2006,,,
177,"216","Mathematicians, Statisticians and Actuaries","Mathématiciens/mathématiciennes, statisticiens/statisticiennes et actuaires",,C06,3,147,2006,,,
178,"2161","Mathematicians, statisticians and actuaries","Mathématiciens/mathématiciennes, statisticiens/statisticiennes et actuaires",,C061,4,177,2006,,,
179,"217",Computer and Information Systems Professionals,Professionnels/professionnelles en informatique,,C07,3,147,2006,,,
180,"2171",Information systems analysts and consultants,Analystes et consultants/consultantes en informatique,,C071,4,179,2006,,,
181,"2172",Database analysts and data administrators,Analystes de bases de données et administrateurs/administratrices de données,,C072,4,179,2006,,,
182,"2173",Software engineers and designers,Ingénieurs/ingénieures et concepteurs/conceptrices en logiciel,,C073,4,179,2006,,,
183,"2174",Computer programmers and interactive media developers,Programmeurs/programmeuses et développeurs/développeuses en médias interactifs,,C074,4,179,2006,,,
184,"2175",Web designers and developers,Concepteurs/conceptrices et développeurs/développeuses Web,,C075,4,179,2006,,,
185,"22",Technical Occupations Related to Natural and Applied Sciences,Personnel technique relié aux sciences naturelles et appliquées,,,2,146,2006,,,
186,"221",Technical Occupations in Physical Sciences,Personnel technique des sciences physiques,,C11,3,185,2006,,,
187,"2211",Chemical technologists and technicians,Technologues et techniciens/techniciennes en chimie,,C111,4,186,2006,,,
188,"2212",Geological and mineral technologists and technicians,Technologues et techniciens/techniciennes en géologie et en minéralogie,,C112,4,186,2006,,,
189,"2213",Meteorological Technicians,Techniciens/techniciennes en météorologie,,C113,4,186,2006,,,
190,"222",Technical Occupations in Life Sciences,Personnel technique des sciences de la vie,,C12,3,185,2006,,,
191,"2221",Biological technologists and technicians,Technologues et techniciens/techniciennes en biologie,,C121,4,190,2006,,,
192,"2222",Agricultural and fish products inspectors,Inspecteurs/inspectrices des produits agricoles et de la pêche,,C122,4,190,2006,,,
193,"2223",Forestry technologists and technicians,Technologues et techniciens/techniciennes en sciences forestières,,C123,4,190,2006,,,
194,"2224",Conservation and fishery officers,Techniciens/techniciennes du milieu naturel et de la pêche,,C124,4,190,2006,,,
195,"2225",Landscape and horticulture technicians and specialists,Techniciens/techniciennes et spécialistes de l'aménagement paysager et de l'horticulture,,C125,4,190,2006,,,
196,"223","Technical Occupations in Civil, Mechanical and Industrial Engineering","Personnel technique en génie civil, mécanique et industriel",,C13,3,185,2006,,,
197,"2231",Civil engineering technologists and technicians,Technologues et techniciens/techniciennes en génie civil,,C131,4,196,2006,,,
198,"2232",Mechanical engineering technologists and technicians,Technologues et techniciens/techniciennes en génie mécanique,,C132,4,196,2006,,,
199,"2233",Industrial engineering and manufacturing technologists and technicians,Technologues et techniciens/techniciennes en génie industriel et en génie de fabrication,,C133,4,196,2006,,,
