73300,"Transport truck drivers",43170,15160,3260,11900,3
73301,"Bus drivers, subway operators and other transit operators",10030,5020,1800,3220,3
73310,"Railway and yard locomotive engineers",1580,700,100,600,3
73311,"Railway conductors and brakemen/women",1400,420,80,340,3
73400,"Heavy equipment operators",13930,5140,1420,3720,3
73401,"Printing press operators",1100,450,80,380,3
73402,"Drillers and blasters - surface mining, quarrying and construction",630,170,40,140,3
74100,"Mail and parcel sorters and related occupations",2870,1230,460,770,4
74101,"Letter carriers",4250,1960,660,1300,4
74102,"Couriers and messengers",4720,1820,730,1090,4
74200,"Railway yard and track maintenance workers",880,250,40,210,4
74201,"Water transport deck and engine room crew",1200,410,180,230,4
74202,"Air transport ramp attendants",2150,850,290,550,4
74203,"Automotive and heavy truck and equipment parts installers and servicers",2080,360,170,190,4
74204,"Utility maintenance workers",560,240,70,170,4
74205,"Public works maintenance equipment operators and related workers",1290,470,130,340,4
75100,"Longshore workers",3520,1950,1020,940,5
75101,"Material handlers",31400,11230,4620,6610,5
75110,"Construction trades helpers and labourers",33540,12300,6010,6290,5
75119,"Other trades helpers and labourers",1220,350,160,180,5
75200,"Taxi and limousine drivers and chauffeurs",7440,3500,1530,1980,5
75201,"Delivery service drivers and door-to-door distributors",16890,5420,2400,3010,5
75210,"Boat and cable ferry operators and related occupations",1300,540,230,310,5
75211,"Railway and motor transport labourers",530,170,60,120,5
75212,"Public works and maintenance labourers",3340,1250,470,780,5
80010,"Managers in natural resources production and fishing",1990,1020,60,960,0
80020,"Managers in agriculture",10140,3010,250,2760,0
80021,"Managers in horticulture",730,280,20,270,0
80022,"Managers in aquaculture",330,130,10,120,0
82010,"Supervisors, logging and forestry",1710,570,0,570,2
82020,"Supervisors, mining and quarrying",1430,600,80,510,2
82021,"Contractors and supervisors, oil and gas drilling and services",770,330,30,300,2
82030,"Agricultural service contractors and farm supervisors",350,90,10,80,2
82031,"Contractors and supervisors, landscaping, grounds maintenance and horticulture services",3340,1350,280,1060,2
83100,"Underground production and development miners",1500,480,60,410,3
83101,"Oil and gas well drillers, servicers, testers and related workers",720,210,60,150,3
83110,"Logging machinery operators",1700,420,-90,510,3
83120,"Fishing masters and officers",80,60,20,40,3
83121,Fishermen/women,300,170,60,110,3
84100,"Underground mine service and support workers",390,120,0,120,4
84101,"Oil and gas well drilling and related workers and services operators",380,90,10,80,4
84110,"Chain saw and skidder operators",2050,320,-150,470,4
84111,"Silviculture and forestry workers",1420,170,-50,220,4
84120,"Specialized livestock workers and farm machinery operators",2790,670,100,570,4
84121,"Fishing vessel deckhands",220,130,60,70,4
85100,"Livestock labourers",2580,490,100,390,5
85101,"Harvesting labourers",1730,410,10,400,5
85102,"Aquaculture and marine harvest labourers",320,90,10,70,5
85103,"Nursery and greenhouse labourers",3020,690,50,640,5
85104,"Trappers and hunters",0,0,0,0,5
85110,"Mine labourers",600,150,30,120,5
85111,"Oil and gas drilling, servicing and related labourers",550,120,10,110,5
85120,"Logging and forestry labourers",1430,40,-130,170,5
85121,"Landscaping and grounds maintenance labourers",17790,5490,2090,3400,5
90010,"Manufacturing managers",11370,4770,680,4090,0
90011,"Utilities managers",1530,890,160,730,0
92010,"Supervisors, mineral and metal processing",480,210,40,170,2
92011,"Supervisors, petroleum, gas and chemical processing and utilities",1070,570,120,450,2
92012,"Supervisors, food and beverage processing",2120,860,320,530,2
92013,"Supervisors, plastic and rubber products manufacturing",190,80,20,70,2
92014,"Supervisors, forest products processing",1320,460,-50,510,2
92015,"Supervisors, textile, fabric, fur and leather products processing and manufacturing",100,50,10,40,2
92020,"Supervisors, motor vehicle assembling",100,60,20,40,2
92021,"Supervisors, electronics and electrical products manufacturing",250,130,30,100,2
92022,"Supervisors, furniture and fixtures manufacturing",80,30,10,20,2
92023,"Supervisors, other mechanical and metal products manufacturing",160,70,20,50,2
92024,"Supervisors, other products manufacturing and assembly",220,70,20,50,2
92100,"Power engineers and power systems operators",6300,2760,500,2260,2
92101,"Water and waste treatment plant operators",1810,770,180,590,2
93100,"Central control and process operators, mineral and metal processing",630,330,50,280,3
93101,"Central control and process operators, petroleum, gas and chemical processing",2290,930,200,730,3
93102,"Pulping, papermaking and coating control operators",180,70,-10,80,3
93200,"Aircraft assemblers and aircraft assembly inspectors",60,20,0,20,3
94100,"Machine operators, mineral and metal processing",670,290,70,230,4
94101,"Foundry workers",100,40,20,30,4
94102,"Glass forming and finishing machine operators and glass cutters",260,70,20,50,4
94103,"Concrete, clay and stone forming operators",420,120,40,80,4
94104,"Inspectors and testers, mineral and metal processing",100,50,10,40,4
94105,"Metalworking and forging machine operators",800,290,80,210,4
94106,"Machining tool operators",340,120,40,80,4
94107,"Machine operators of other metal products",80,30,10,30,4
94110,"Chemical plant machine operators",360,130,40,100,4
94111,"Plastics processing machine operators",600,250,50,200,4
94112,"Rubber processing machine operators and related workers",130,50,10,40,4
94120,"Sawmill machine operators",1890,500,-110,610,4
94121,"Pulp mill, papermaking and finishing machine operators",1120,340,-60,400,4
94122,"Paper converting machine operators",180,40,-20,60,4
94123,"Lumber graders and other wood processing inspectors and graders",820,210,-40,250,4
94124,"Woodworking machine operators",660,190,10,180,4
94129,"Other wood processing machine operators",590,150,-50,200,4
94130,"Textile fibre and yarn, hide and pelt processing machine operators and workers",170,50,20,30,4
94131,"Weavers, knitters and other fabric making occupations",130,40,10,30,4
94132,"Industrial sewing machine operators",1340,680,160,520,4
94133,"Inspectors and graders, textile, fabric, fur and leather products manufacturing",170,60,20,40,4
94140,"Process control and machine operators, food and beverage processing",7070,2190,710,1480,4
94141,"Industrial butchers and meat cutters, poultry preparers and related workers",1830,760,300,460,4
94142,"Fish and seafood plant workers",970,510,170,340,4
94143,"Testers and graders, food and beverage processing",910,290,100,200,4
94150,"Plateless printing equipment operators",540,210,30,180,4
94151,"Camera, platemaking and other prepress occupations",130,50,10,40,4
94152,"Binding and finishing machine operators",260,100,20,80,4
94153,"Photographic and film processors",370,150,70,80,4
94200,"Motor vehicle assemblers, inspectors and testers",1010,430,150,280,4
94201,"Electronics assemblers, fabricators, inspectors and testers",1280,500,170,330,4
94202,"Assemblers and inspectors, electrical appliance, apparatus and equipment manufacturing",360,170,60,120,4
94203,"Assemblers, fabricators and inspectors, industrial electrical motors and transformers",70,20,10,10,4
94204,"Mechanical assemblers and inspectors",900,400,160,240,4
94205,"Machine operators and inspectors, electrical apparatus manufacturing",110,50,10,40,4
94210,"Furniture and fixture assemblers, finishers, refinishers and inspectors",1590,480,120,360,4
94211,"Assemblers and inspectors of other wood products",1050,240,-10,250,4
94212,"Plastic products assemblers, finishers and inspectors",270,90,20,70,4
94213,"Industrial painters, coaters and metal finishing process operators",1610,610,160,440,4
94219,"Other products assemblers, finishers and inspectors",2430,870,240,630,4
95100,"Labourers in mineral and metal processing",1090,330,70,250,5
95101,"Labourers in metal fabrication",1450,360,40,320,5
95102,"Labourers in chemical products processing and utilities",730,290,90,190,5
95103,"Labourers in wood, pulp and paper processing",5100,920,-310,1230,5
95104,"Labourers in rubber and plastic products manufacturing",510,150,60,90,5
95105,"Labourers in textile processing and cutting",520,230,80,150,5
95106,"Labourers in food and beverage processing",14220,6230,2370,3860,5
95107,"Labourers in fish and seafood processing",720,370,120,250,5
95109,"Other labourers in processing, manufacturing and utilities",8120,2680,870,1810,5
